{
  "$schema": "https://raw.githubusercontent.com/1aGh/maude/main/apps/studio/schema/ds-schema-v1.schema.json",
  "format": "maude.ds-schema",
  "schemaVersion": 1,
  "valueTypes": {
    "color": {
      "forms": ["var-ref", "hex", "color-function", "named-color", "light-dark"]
    },
    "length": {
      "forms": ["var-ref", "zero", "dimension", "percentage", "math"]
    },
    "length-or-none": {
      "forms": ["var-ref", "zero", "dimension", "percentage", "math", "none"]
    },
    "duration": {
      "forms": ["var-ref", "time", "math"]
    },
    "easing": {
      "forms": ["var-ref", "easing-keyword", "cubic-bezier", "steps", "linear-function"]
    },
    "number": {
      "forms": ["var-ref", "zero", "number", "math"]
    },
    "line-height": {
      "forms": ["var-ref", "zero", "number", "dimension", "percentage", "normal", "math"]
    },
    "font-family": {
      "forms": ["var-ref", "family-list"]
    },
    "shadow": {
      "forms": ["var-ref", "none", "shadow-layers"]
    }
  },
  "themeRule": {
    "colorRolesPerTheme": true,
    "rootCountsForDefaultTheme": true,
    "lightDarkCountsForBoth": true,
    "countedRules": ["top-level", "layer"]
  },
  "roles": [
    {
      "name": "--bg-0",
      "group": "surfaces",
      "origin": "ddr-043",
      "type": "color",
      "perTheme": true,
      "meaning": "page / canvas surface (deepest)",
      "fallback": null
    },
    {
      "name": "--bg-1",
      "group": "surfaces",
      "origin": "ddr-043",
      "type": "color",
      "perTheme": true,
      "meaning": "card / panel body",
      "fallback": null
    },
    {
      "name": "--bg-2",
      "group": "surfaces",
      "origin": "ddr-043",
      "type": "color",
      "perTheme": true,
      "meaning": "popover, menu, sheet",
      "fallback": null
    },
    {
      "name": "--bg-3",
      "group": "surfaces",
      "origin": "ddr-043",
      "type": "color",
      "perTheme": true,
      "meaning": "input well, row hover",
      "fallback": null
    },
    {
      "name": "--bg-4",
      "group": "surfaces",
      "origin": "ddr-043",
      "type": "color",
      "perTheme": true,
      "meaning": "pressed / selected without accent",
      "fallback": null
    },
    {
      "name": "--fg-0",
      "group": "text",
      "origin": "ddr-043",
      "type": "color",
      "perTheme": true,
      "meaning": "primary text",
      "fallback": null
    },
    {
      "name": "--fg-1",
      "group": "text",
      "origin": "ddr-043",
      "type": "color",
      "perTheme": true,
      "meaning": "secondary text",
      "fallback": null
    },
    {
      "name": "--fg-2",
      "group": "text",
      "origin": "ddr-043",
      "type": "color",
      "perTheme": true,
      "meaning": "tertiary text, meta",
      "fallback": null
    },
    {
      "name": "--fg-3",
      "group": "text",
      "origin": "ddr-043",
      "type": "color",
      "perTheme": true,
      "meaning": "disabled text, non-text ornament",
      "fallback": null
    },
    {
      "name": "--border-subtle",
      "group": "borders",
      "origin": "ddr-043",
      "type": "color",
      "perTheme": true,
      "meaning": "hairline between related surfaces",
      "fallback": null
    },
    {
      "name": "--border-default",
      "group": "borders",
      "origin": "ddr-043",
      "type": "color",
      "perTheme": true,
      "meaning": "default control / card border",
      "fallback": null
    },
    {
      "name": "--border-strong",
      "group": "borders",
      "origin": "ddr-043",
      "type": "color",
      "perTheme": true,
      "meaning": "emphasised border, dividers that must read",
      "fallback": null
    },
    {
      "name": "--accent",
      "group": "accent",
      "origin": "ddr-043",
      "type": "color",
      "perTheme": true,
      "meaning": "the action fill: primary button, current selection",
      "fallback": null
    },
    {
      "name": "--accent-hover",
      "group": "accent",
      "origin": "ddr-043-de-facto",
      "type": "color",
      "perTheme": true,
      "meaning": "action fill on hover",
      "fallback": null
    },
    {
      "name": "--accent-active",
      "group": "accent",
      "origin": "ddr-043-de-facto",
      "type": "color",
      "perTheme": true,
      "meaning": "action fill while pressed",
      "fallback": null
    },
    {
      "name": "--accent-fg",
      "group": "accent",
      "origin": "ddr-043-de-facto",
      "type": "color",
      "perTheme": true,
      "meaning": "text and icons on the action fill",
      "fallback": null
    },
    {
      "name": "--status-success",
      "group": "status",
      "origin": "ddr-043",
      "type": "color",
      "perTheme": true,
      "meaning": "success fill and icon",
      "fallback": null
    },
    {
      "name": "--status-warn",
      "group": "status",
      "origin": "ddr-043",
      "type": "color",
      "perTheme": true,
      "meaning": "warn fill and icon",
      "fallback": null
    },
    {
      "name": "--status-error",
      "group": "status",
      "origin": "ddr-043",
      "type": "color",
      "perTheme": true,
      "meaning": "error fill and icon",
      "fallback": null
    },
    {
      "name": "--status-info",
      "group": "status",
      "origin": "ddr-043",
      "type": "color",
      "perTheme": true,
      "meaning": "info fill and icon",
      "fallback": null
    },
    {
      "name": "--presence-online",
      "group": "presence",
      "origin": "ddr-043",
      "type": "color",
      "perTheme": true,
      "meaning": "collaborator online dot",
      "fallback": null,
      "family": "presence"
    },
    {
      "name": "--presence-away",
      "group": "presence",
      "origin": "ddr-043",
      "type": "color",
      "perTheme": true,
      "meaning": "collaborator away dot",
      "fallback": null,
      "family": "presence"
    },
    {
      "name": "--presence-offline",
      "group": "presence",
      "origin": "ddr-043",
      "type": "color",
      "perTheme": true,
      "meaning": "collaborator offline dot",
      "fallback": null,
      "family": "presence"
    },
    {
      "name": "--shadow-sm",
      "group": "elevation",
      "origin": "ddr-043",
      "type": "shadow",
      "perTheme": false,
      "meaning": "low elevation: controls, chips",
      "fallback": null
    },
    {
      "name": "--shadow-md",
      "group": "elevation",
      "origin": "ddr-043",
      "type": "shadow",
      "perTheme": false,
      "meaning": "mid elevation: cards, popovers",
      "fallback": null
    },
    {
      "name": "--shadow-lg",
      "group": "elevation",
      "origin": "ddr-043",
      "type": "shadow",
      "perTheme": false,
      "meaning": "high elevation: dialogs, sheets",
      "fallback": null
    },
    {
      "name": "--radius-xs",
      "group": "radius",
      "origin": "ddr-043",
      "type": "length",
      "perTheme": false,
      "meaning": "smallest corner: chips, tags",
      "fallback": null
    },
    {
      "name": "--radius-sm",
      "group": "radius",
      "origin": "ddr-043",
      "type": "length",
      "perTheme": false,
      "meaning": "small controls",
      "fallback": null
    },
    {
      "name": "--radius-md",
      "group": "radius",
      "origin": "ddr-043",
      "type": "length",
      "perTheme": false,
      "meaning": "default control corner",
      "fallback": null
    },
    {
      "name": "--radius-lg",
      "group": "radius",
      "origin": "ddr-043",
      "type": "length",
      "perTheme": false,
      "meaning": "cards, panels",
      "fallback": null
    },
    {
      "name": "--radius-xl",
      "group": "radius",
      "origin": "ddr-043",
      "type": "length",
      "perTheme": false,
      "meaning": "sheets, large islands",
      "fallback": null
    },
    {
      "name": "--radius-pill",
      "group": "radius",
      "origin": "ddr-043",
      "type": "length",
      "perTheme": false,
      "meaning": "fully rounded",
      "fallback": null
    },
    {
      "name": "--space-0",
      "group": "space",
      "origin": "ddr-043",
      "type": "length",
      "perTheme": false,
      "meaning": "spacing step 0 of the ordinal ladder",
      "fallback": null
    },
    {
      "name": "--space-1",
      "group": "space",
      "origin": "ddr-043",
      "type": "length",
      "perTheme": false,
      "meaning": "spacing step 1 of the ordinal ladder",
      "fallback": null
    },
    {
      "name": "--space-2",
      "group": "space",
      "origin": "ddr-043",
      "type": "length",
      "perTheme": false,
      "meaning": "spacing step 2 of the ordinal ladder",
      "fallback": null
    },
    {
      "name": "--space-3",
      "group": "space",
      "origin": "ddr-043",
      "type": "length",
      "perTheme": false,
      "meaning": "spacing step 3 of the ordinal ladder",
      "fallback": null
    },
    {
      "name": "--space-4",
      "group": "space",
      "origin": "ddr-043",
      "type": "length",
      "perTheme": false,
      "meaning": "spacing step 4 of the ordinal ladder",
      "fallback": null
    },
    {
      "name": "--space-5",
      "group": "space",
      "origin": "ddr-043",
      "type": "length",
      "perTheme": false,
      "meaning": "spacing step 5 of the ordinal ladder",
      "fallback": null
    },
    {
      "name": "--space-6",
      "group": "space",
      "origin": "ddr-043",
      "type": "length",
      "perTheme": false,
      "meaning": "spacing step 6 of the ordinal ladder",
      "fallback": null
    },
    {
      "name": "--space-7",
      "group": "space",
      "origin": "ddr-043",
      "type": "length",
      "perTheme": false,
      "meaning": "spacing step 7 of the ordinal ladder",
      "fallback": null
    },
    {
      "name": "--space-8",
      "group": "space",
      "origin": "ddr-043",
      "type": "length",
      "perTheme": false,
      "meaning": "spacing step 8 of the ordinal ladder",